{
  "orkyVideoId": "vid_3f1",
  "requestId": "req_7c41",
  "status": "published",
  "videoUrl": "https://orky.local/v/vid_3f1",
  "sourceVideoUrl": "https://www.tiktok.com/@boutique.test/video/7344321987654321987",
  "orchidyMarketplaceProductId": "mp_2026-0913",
  "createdAt": "2026-09-01T11:06:00.000Z",
  "error": null
}